<?xml version="1.0" encoding="UTF-8"?>
<project xmlns="http://www.coderage.com/2008/project"
  xmlns:xsi="http://www.w3.org/2001/XMLSchema-instance"
  xsi:schemaLocation="http://www.coderage.com/2008/project
  ../project.xsd">
  <info>
    <label>Package Pass 4</label>
    <description>
      Installs a package with a channel
    </description>
  </info>
  <targets>
    <testConfiguration status="true" id="ignore">
      <packageConfiguration version="1.0">
        <package name="Foo" version="1.5" channel="http://www.test.com/"/>
        <channel url="http://www.test.com/"/>
      </packageConfiguration>
    </testConfiguration>
    <packageGroup framework="test">
      <package name="Foo" channel="http://www.test.com/"/>
    </packageGroup>
  </targets>
</project>
